Authors,Title,Year,Source title,Volume,Issue,Art. No.,Page start,Page end,Page count,Cited by,DOI,Link,Document Type,Source,EID
"Énekesová, E., Šestáková, A., Krumpálová, Z.","A first record of Glyphesis taoplesius (Linyphiidae, Araneae) from Slovakia",2011,"Arachnologische Mitteilungen",,"42",,"16","20",,,10.5431/aramit4204,"https://www.scopus.com/inward/record.uri?eid=2-s2.0-84856189462&partnerID=40&md5=1d492764c9b41fa71b40183c14390a4b",Article,Scopus,2-s2.0-84856189462
"Barthel, R., Krimly, T., Elbers, M., Soboll, A., Wackerbauer, J., Hennicker, R., Janisch, S., Reichenau, T.G., Dabbert, S., Schmude, J., Ernst, A., Mauser, W.","Global change impacts on groundwater in Southern Germany-Part 2: Socioeconomic aspects [Folgen des Globalen Wandels für das Grundwasser in Süddeutschland - Teil 2: Sozioökonomische Aspekte]",2011,"Grundwasser","16","4",,"259","268",,3,10.1007/s00767-011-0180-y,"https://www.scopus.com/inward/record.uri?eid=2-s2.0-81855227220&partnerID=40&md5=d02e6d4ffc0b7cf600586aedede973e2",Article,Scopus,2-s2.0-81855227220
"Bódis, E., Nosek, J., Oertel, N., Tóth, B., Hornung, E., Sousa, R.","Spatial distribution of bivalves in relation to environmental conditions (middle Danube catchment, Hungary)",2011,"Community Ecology","12","2",,"210","219",,10,10.1556/ComEc.12.2011.2.9,"https://www.scopus.com/inward/record.uri?eid=2-s2.0-81755161597&partnerID=40&md5=07ca723353b7083baa8bd06985b1b6cf",Article,Scopus,2-s2.0-81755161597
"Barthel, R., Reichenau, T.G., Muerth, M., Heinzeller, C., Schneider, K., Hennicker, R., Mauser, W.","Global change impacts on groundwater in Southern Germany-Part 1: Natural aspects [Folgen des Globalen Wandels für das Grundwasser in Süddeutschland - Teil 1: Naturräumliche Aspekte]",2011,"Grundwasser","16","4",,"247","257",,4,10.1007/s00767-011-0179-4,"https://www.scopus.com/inward/record.uri?eid=2-s2.0-81855177366&partnerID=40&md5=249a98dc234873d09da0240f633cb67f",Article,Scopus,2-s2.0-81855177366
"Dunǎrinţu, A.","Sustainable management in the Danube Delta-the way to sustainable development",2011,"Quality - Access to Success","12","SUPPL. 2",,"1009","1013",,,,"https://www.scopus.com/inward/record.uri?eid=2-s2.0-84866947450&partnerID=40&md5=58eec80e1340a527ddfd2501e5e17032",Article,Scopus,2-s2.0-84866947450
"Maksin, M.","Crucial European and international strategic documents for guiding the spatial development of the Danube Region in Serbia",2011,"Spatium",,"26",,"33","39",,,10.2298/SPAT1126033M,"https://www.scopus.com/inward/record.uri?eid=2-s2.0-84861469190&partnerID=40&md5=0ceadbc8d833c125ae4fbb898c790c61",Article,Scopus,2-s2.0-84861469190
"Molnár, T., Lehoczky, I., Molnár, M., Benedek, I., Magyary, I., Jeney, Z., Zsolnai, A.","Genetic diversity of the European pond turtle (Emys orbicularis) in the South-West region of Hungary - First results",2011,"Amphibia Reptilia","32","4",,"519","526",,2,10.1163/156853811X610744,"https://www.scopus.com/inward/record.uri?eid=2-s2.0-84855571068&partnerID=40&md5=fc75dd2da95240c4777f3a4c7245e932",Article,Scopus,2-s2.0-84855571068
"Ursprung, J., Prosl, H.","The American Giant Liver Fluke (Fascioloides magna) in the Danube floodplain forests east of Vienna, Austria. Occurrence and control 2000 - 2010 [Vorkommen und Bekämpfung des Amerikanischen Riesenleberegels (Fascioloides magna) in den österreichischen Donauauen östlich von Wien 2000 - 2010]",2011,"Wiener Tierarztliche Monatsschrift","98","11-12",,"275","284",,5,,"https://www.scopus.com/inward/record.uri?eid=2-s2.0-84862502687&partnerID=40&md5=22d250b56b9b14b7c825b3c19a7a7744",Article,Scopus,2-s2.0-84862502687
"Peršić, V., Čerba, D., Bogut, I., Horvatić, J.","Trophic state and water quality in the Danube floodplain lake (Kopački Rit Nature Park, Croatia) in relation to hydrological connectivity",2011,"Eutrophication: Causes, Consequences and Control",,,,"109","129",,,10.1007/978-90-481-9625-8-5,"https://www.scopus.com/inward/record.uri?eid=2-s2.0-84892358417&partnerID=40&md5=0f0ca4f8f6edd4ae8604fc85775d1b5b",Book Chapter,Scopus,2-s2.0-84892358417
"Sayner, J.","Educating educators of memory: Reflections on an insite teaching program",2011,"Journal of Educational Media, Memory, and Society","3","2",,"137","154",,1,10.3167/jemms.2011.030208,"https://www.scopus.com/inward/record.uri?eid=2-s2.0-84859352789&partnerID=40&md5=75237a56b398423f177b85dc91a3c1fd",Article,Scopus,2-s2.0-84859352789
"Vidaković, J., Palijan, G., Čerba, D.","Relationship between nematode community and biomass and composition of periphyton developing on artificial substrates in floodplain Lake",2011,"Polish Journal of Ecology","59","3",,"577","588",,5,,"https://www.scopus.com/inward/record.uri?eid=2-s2.0-84856862441&partnerID=40&md5=5aa4d36179b0bb2cf2de65e40c11cafa",Article,Scopus,2-s2.0-84856862441
"Hörweg, C., Prosl, H., Wille-Piazzai, W., Joachim, A., Sattmann, H.","Prevalence of Fascioloides magna in Galba truncatula in the Danube backwater area east of Vienna, Austria",2011,"Wiener Tierarztliche Monatsschrift","98","11-12",,"261","267",,3,,"https://www.scopus.com/inward/record.uri?eid=2-s2.0-84862507459&partnerID=40&md5=2bf15c0774ba901f9e32f4f6f77477e3",Article,Scopus,2-s2.0-84862507459
"Vosniakos, F., Vasile, G., Albanis, T., Petre, J., Stanescu, E., Cruceru, L., Nicolau, M., Kochubovski, M., Gjorgjev, D., Nikolaou, K., Golumbeanu, M., Vosniakos, K., Vasilikiotis, G.","Comparison Study of Physicochemical Parameters Evaluation between Danube River Delta and AXIOS-VARDAR River Valley (2003-2009)",2011,"NATO Science for Peace and Security Series C: Environmental Security","1",,,"257","286",,2,10.1007/978-94-007-0253-0_16,"https://www.scopus.com/inward/record.uri?eid=2-s2.0-84883190433&partnerID=40&md5=9a001960fd145ea8617eef202cd661b0",Article,Scopus,2-s2.0-84883190433
"Ot'ahel'ová, H., Oahe, J., Pazúr, R., Hrivnák, R., Valachovič, M.","Spatio-temporal changes in land cover and aquatic macrophytes of the Danube floodplain lake",2011,"Limnologica","41","4",,"316","324",,4,10.1016/j.limno.2011.01.005,"https://www.scopus.com/inward/record.uri?eid=2-s2.0-80054097281&partnerID=40&md5=08c5ee519e93ba5d32733a8f133208bf",Article,Scopus,2-s2.0-80054097281
"Florea, L.","Characteristics of freshwater fish population in the Danube river near Braila within the period 2006-2008",2011,"Journal of Environmental Protection and Ecology","12","3",,"814","823",,,,"https://www.scopus.com/inward/record.uri?eid=2-s2.0-80055095072&partnerID=40&md5=5c5b052ded349006cb2f442cd9a279f4",Article,Scopus,2-s2.0-80055095072
"Pišút, P.","The 1787 flood of the River Danube in Bratislava [Dunajská povodeň roku 1787 a bratislava]",2011,"Geograficky Casopis","63","1",,"87","109",,2,,"https://www.scopus.com/inward/record.uri?eid=2-s2.0-80055078611&partnerID=40&md5=80c1a32c5af53cc1fc5284ac11c00e2b",Article,Scopus,2-s2.0-80055078611
"Sakan, S., Dordević, D., Dević, G., Relić, D., Andelković, I., Duričić, J.","A study of trace element contamination in river sediments in Serbia using microwave-assisted aqua regia digestion and multivariate statistical analysis",2011,"Microchemical Journal","99","2",,"492","502",,31,10.1016/j.microc.2011.06.027,"https://www.scopus.com/inward/record.uri?eid=2-s2.0-80052373014&partnerID=40&md5=c6a4cfe2b44757e00d5eef03a2e467f7",Article,Scopus,2-s2.0-80052373014
"Camenen, B., Holubová, K., Lukač, M., Le Coz, J., Paquier, A.","Assessment of Methods Used in 1D Models for Computing Bed-Load Transport in a Large River: The Danube River in Slovakia",2011,"Journal of Hydraulic Engineering","137","10",,"1190","1199",,8,10.1061/(ASCE)HY.1943-7900.0000427,"https://www.scopus.com/inward/record.uri?eid=2-s2.0-80155159125&partnerID=40&md5=58832c717b1e44821c819a5d34accab3",Article,Scopus,2-s2.0-80155159125
"Gjetvaj, G., Lončar, G., Malus, D., Ocvirk, E.","Example of interdependence between surface waters and ground waters [Primjeri meduutjecaja površinskih i podzemnih voda]",2011,"Gradjevinar","63","11",,"941","951",,,,"https://www.scopus.com/inward/record.uri?eid=2-s2.0-83455195347&partnerID=40&md5=38d20dfcaca8bf224ccc63fce5507526",Article,Scopus,2-s2.0-83455195347
"Romanenko, V.D., Lyashenko, A.V., Afanasyev, S.A., Konovets, I.N., Kipnis, L.S., Zorina-Sakharova, Ye.Ye., Terletskaya, A.V., Milyukin, M.V., Demchenko, V.Ya., Burgess, R.M., Kho, K.T.","Comprehensive characteristics of bottom sediments of water bodies of various types in the Kiliya delta of the Danube River",2011,"Hydrobiological Journal","47","5",,"3","20",,2,10.1615/HydrobJ.v47.i5.10,"https://www.scopus.com/inward/record.uri?eid=2-s2.0-80054678689&partnerID=40&md5=1ba312c167c3e11fe36156a9d05899cb",Article,Scopus,2-s2.0-80054678689
"Sefcakova, A., Katina, S., Mizera, I., Halouzka, R., Barta, P., Thurzo, M.","A late upper palaeolithic skull from Moča (the Slovak republic) in the context of central Europe",2011,"Acta Musei Nationalis Pragae, Series B - Historia Naturalis","67","1-2",,"3","24",,1,,"https://www.scopus.com/inward/record.uri?eid=2-s2.0-80053274118&partnerID=40&md5=e58bd7ad2652728e33b26499f34398bf",Article,Scopus,2-s2.0-80053274118
"Janković, S., Ćurcǐć, M., Radicěvić, T., Stefanović, S., Lenhardt, M., Durgo, K., Antonijevíc, B.","Non-dioxin-like PCBs in ten different fish species from the Danube river in Serbia",2011,"Environmental Monitoring and Assessment","181","1-4",,"153","163",,9,10.1007/s10661-010-1820-x,"https://www.scopus.com/inward/record.uri?eid=2-s2.0-80054720795&partnerID=40&md5=a1d3851c748337da1c376787e0fa581d",Article,Scopus,2-s2.0-80054720795
"Koch, F., Prasch, M., Bach, H., Mauser, W., Appel, F., Weber, M.","How will hydroelectric power generation develop under climate change scenarios? A case study in the upper danube basin",2011,"Energies","4","10",,"1508","1541",,16,10.3390/en4101508,"https://www.scopus.com/inward/record.uri?eid=2-s2.0-80455179704&partnerID=40&md5=3e0ec2eb13cffa394e6d5033a48859dd",Article,Scopus,2-s2.0-80455179704
"Pekárik, L., Švátora, M., Černý, J., Koščo, J.","Longitudinal structure of fish assemblages in a minimally disrupted stream",2011,"Biologia","66","5",,"886","892",,1,10.2478/s11756-011-0097-z,"https://www.scopus.com/inward/record.uri?eid=2-s2.0-79961151685&partnerID=40&md5=0d3954afad3e12a413ab5d96d1fa2608",Article,Scopus,2-s2.0-79961151685
"van Assche, K., Beunen, R., Jacobs, J., Teampau, P.","Crossing trails in the marshes: Rigidity and flexibility in the governance of the Danube delta",2011,"Journal of Environmental Planning and Management","54","8",,"997","1018",,25,10.1080/09640568.2010.547687,"https://www.scopus.com/inward/record.uri?eid=2-s2.0-80051555915&partnerID=40&md5=5305b18f1a44bd6112f18d941a192ff6",Article,Scopus,2-s2.0-80051555915
"Roadevin, N., Bordei, M., Ciurea, A., Popa, D.","Study on the Danube river water quality in Braila county",2011,"Metalurgia International","16","12",,"152","155",,,,"https://www.scopus.com/inward/record.uri?eid=2-s2.0-80052839552&partnerID=40&md5=2a1247c33e39ff9c7eda3865ecc40ef6",Article,Scopus,2-s2.0-80052839552
"Yigiterhan, O., Murray, J.W., Tugrul, S.","Trace metal composition of suspended particulate matter in the water column of the Black Sea",2011,"Marine Chemistry","126","1-4",,"207","228",,16,10.1016/j.marchem.2011.05.006,"https://www.scopus.com/inward/record.uri?eid=2-s2.0-80051948519&partnerID=40&md5=975edb6d9ad7b08b4ad6bb910e0bfb40",Article,Scopus,2-s2.0-80051948519
"Donzier, J., Kolokytha, E., Del Castillo-Laborde, L., Stephan, R.M., Brels, S., Coates, D., Loures, F.R., Kober, K., Vaes, G., Jacquin, N., Ganoulis, J., Antonelli, F., Karaa, K., Rhaouti, S., Strosser, P., Pennequin, D., de Gramont, H.M., Ninković, D., Mladenović, M.B., Milovanović, M., Dimkić, M., Milovanović, D., Skias, S., Kallioras, A., Pliakas, F.","Global Challenges and the European Paradigm",2011,"Transboundary Water Resources Management: A Multidisciplinary Approach",,,,"27","85",,1,10.1002/9783527636655.ch3,"https://www.scopus.com/inward/record.uri?eid=2-s2.0-84886108787&partnerID=40&md5=2ded4a89230f5dd763e7ef463739708d",Book Chapter,Scopus,2-s2.0-84886108787
"Mölder, A., Schneider, E.","On the beautiful diverse Danube? Danubian floodplain forest vegetation and flora under the influence of river eutrophication",2011,"River Research and Applications","27","7",,"881","894",,7,10.1002/rra.1403,"https://www.scopus.com/inward/record.uri?eid=2-s2.0-80052005715&partnerID=40&md5=eefeb592008a6f0586053a3f78ac7bca",Article,Scopus,2-s2.0-80052005715
"Reichert, G.","Transboundary groundwater law in Europe: A look at an evolving multi-level regime",2011,"Water International","36","5",,"686","691",,,10.1080/02508060.2011.606784,"https://www.scopus.com/inward/record.uri?eid=2-s2.0-80052300465&partnerID=40&md5=0e6c2884f583b300cc78f5ca949b9a0b",Article,Scopus,2-s2.0-80052300465
"Tritthart, M., Welti, N., Bondar-Kunze, E., Pinay, G., Hein, T., Habersack, H.","Modelling highly variable environmental factors to assess potential microbial respiration in complex floodplain landscapes",2011,"Environmental Modelling and Software","26","9",,"1097","1111",,6,10.1016/j.envsoft.2011.04.001,"https://www.scopus.com/inward/record.uri?eid=2-s2.0-79955916754&partnerID=40&md5=ea4a4d65a7a278cc00bd88cbb71000bd",Article,Scopus,2-s2.0-79955916754
"Diyachenko, T.N.","Dynamics of the higher aquatic vegetation of water bodies of the danube kiliya delta under anthropogenic impact",2011,"Hydrobiological Journal","47","1",,"29","40",,,10.1615/HydrobJ.v47.i1.30,"https://www.scopus.com/inward/record.uri?eid=2-s2.0-80051621716&partnerID=40&md5=e5382a2e14e560bfdcc46bd9bd35d06d",Article,Scopus,2-s2.0-80051621716
"Galić, Z., Orlović, S., Vasić, V., Galović, V., Klašnja, B., Stojanović, D., Babić, V.","phytocoenological characteristics in poplar plantations in the protected region of the Central Danube Basin",2011,"Archives of Biological Sciences","63","3",,"811","817",,1,10.2298/ABS1103811G,"https://www.scopus.com/inward/record.uri?eid=2-s2.0-79961187130&partnerID=40&md5=8bccec5eb0e64df52b7bda442679f0f7",Article,Scopus,2-s2.0-79961187130
"Schöll, K., Szövényi, G.","Planktonic rotifer assemblages of the Danube river at Budapest after the red sludge pollution in Hungary",2011,"Bulletin of Environmental Contamination and Toxicology","87","2",,"124","128",,4,10.1007/s00128-011-0331-y,"https://www.scopus.com/inward/record.uri?eid=2-s2.0-79960557952&partnerID=40&md5=069b61de06578b8097d4c8878031bbfe",Article,Scopus,2-s2.0-79960557952
"Das, S.","Cleaning of the Ganga",2011,"Journal of the Geological Society of India","78","2",,"124","130",,3,10.1007/s12594-011-0073-9,"https://www.scopus.com/inward/record.uri?eid=2-s2.0-80052674049&partnerID=40&md5=24df3aca119d1e5c468306cfd18552e0",Article,Scopus,2-s2.0-80052674049
"Marčić, Z., Buj, I., Duplić, A., Ćaleta, M., Mustafić, P., Zanella, D., Zupančič, P., Mrakovčić, M.","A new endemic cyprinid species from the Danube drainage",2011,"Journal of Fish Biology","79","2",,"418","430",,2,10.1111/j.1095-8649.2011.03038.x,"https://www.scopus.com/inward/record.uri?eid=2-s2.0-79960696790&partnerID=40&md5=bbaed3094f5467beea9528d805ae0157",Article,Scopus,2-s2.0-79960696790
"Sârbu, A., Janauer, G., Schmidt-Mumm, U., Filzmoser, P., Smarandache, D., Pascale, G.","Characterisation of the potamal Danube River and the Delta: Connectivity determines indicative macrophyte assemblages",2011,"Hydrobiologia","671","1",,"75","93",,7,10.1007/s10750-011-0705-5,"https://www.scopus.com/inward/record.uri?eid=2-s2.0-79959189519&partnerID=40&md5=c7d65954fedc09a0db48a1c12098e1b0",Article,Scopus,2-s2.0-79959189519
"Schreitl, B., Schröfelbauer, T., Wanker, C., Steiner, M.","How asfinag decides construction methods [Baumethodenentscheidung bei der asfinag]",2011,"Geomechanik und Tunnelbau","4","4",,"317","326",,1,10.1002/geot.201100020,"https://www.scopus.com/inward/record.uri?eid=2-s2.0-79961183053&partnerID=40&md5=6f868b4376173ae583f147f6f2920cce",Article,Scopus,2-s2.0-79961183053
"Mustać, I., Gjetvaj, G., Petošić, D., Tomić, F.","Impact of the future multipurpose danube-sava canal on groundwater dynamics [Utjecaj budućeg višenamjenskog kanala Dunav-Sava na dinamiku podzemnih voda]",2011,"Tehnicki Vjesnik","18","2",,"211","218",,4,,"https://www.scopus.com/inward/record.uri?eid=2-s2.0-79959877530&partnerID=40&md5=ca28f2f9b4e8a8bf36ce745c79a989b2",Article,Scopus,2-s2.0-79959877530
"Lyashenko, A.V., Makovskiy, V.V.","Mollusks of the genus Corbicula in the Ukrainian section of the Danube River",2011,"Hydrobiological Journal","47","3",,"39","47",,,10.1615/HydrobJ.v47.i3.50,"https://www.scopus.com/inward/record.uri?eid=2-s2.0-79959771251&partnerID=40&md5=33923954daaa146c5ec7e7b2446c735c",Article,Scopus,2-s2.0-79959771251
"Zeković, S., Maričić, T.","Comparative risk analysis of development of the lignite basins in Serbian part of the Danube region",2011,"Recent Researches in Energy and Environment - 6th IASME / WSEAS International Conference on Energy and Environment, EE'11",,,,"171","176",,,,"https://www.scopus.com/inward/record.uri?eid=2-s2.0-79958732124&partnerID=40&md5=536fa28759d9d40ae263467ecfb65f5d",Conference Paper,Scopus,2-s2.0-79958732124
"Sakan, S.M., Dordević, D.S., Trifunović, S.S.","Geochemical and statistical methods in the evaluation of trace elements contamination: An application on canal sediments",2011,"Polish Journal of Environmental Studies","20","1",,"187","199",,10,,"https://www.scopus.com/inward/record.uri?eid=2-s2.0-79958093863&partnerID=40&md5=ae5a8a78d64c80975f47202fd5ea50b6",Article,Scopus,2-s2.0-79958093863
"Bugya, T., Fábián, S.Á., Görcs, N.L., Kovács, I.P., Radvánszky, B.","Surface changes on a landslide affected high bluff in Dunaszekcso (Hungary)",2011,"Central European Journal of Geosciences","3","2",,"119","128",,2,10.2478/s13533-011-0014-6,"https://www.scopus.com/inward/record.uri?eid=2-s2.0-80052682510&partnerID=40&md5=b02edfb8384a98e360fd842e3b41d30c",Article,Scopus,2-s2.0-80052682510
"Rusu, D.","Regionalization in the black sea area: A comparative study",2011,"Romanian Journal of European Affairs","11","2",,"47","65",,,,"https://www.scopus.com/inward/record.uri?eid=2-s2.0-84859041074&partnerID=40&md5=ec6f01f5cd8740928afd2c4065740155",Article,Scopus,2-s2.0-84859041074
"Bódis, E., Nosek, J., Oertel, N., Tóth, B., Fehér, Z.","A Comparative Study of Two Corbicula Morphs (Bivalvia, Corbiculidae) Inhabiting River Danube",2011,"International Review of Hydrobiology","96","3",,"257","273",,10,10.1002/iroh.201111344,"https://www.scopus.com/inward/record.uri?eid=2-s2.0-79959450141&partnerID=40&md5=445c6e3544e7a735f6838206af5a4311",Article,Scopus,2-s2.0-79959450141
"Tritthart, M., Liedermann, M., Schober, B., Habersack, H.","Non-uniformity and layering in sediment transport modelling 2: River application",2011,"Journal of Hydraulic Research","49","3",,"335","344",,13,10.1080/00221686.2011.583487,"https://www.scopus.com/inward/record.uri?eid=2-s2.0-79959434650&partnerID=40&md5=3fecc998d38424c3a9fcad1dff2c56ab",Article,Scopus,2-s2.0-79959434650
"Mészáros, O., Serlegi, G.","The impact of environmental change on medieval settlement structure in Transdanubia",2011,"Acta Archaeologica Academiae Scientiarum Hungaricae","62","1",,"199","219",,1,10.1556/AArch.62.2011.1.9,"https://www.scopus.com/inward/record.uri?eid=2-s2.0-79960260088&partnerID=40&md5=2f3850f636ca7f0cf33f6335ee1af711",Article,Scopus,2-s2.0-79960260088
"Mihic, S., Golusin, M., Mihajlovic, M.","Policy and promotion of sustainable inland waterway transport in Europe - Danube River",2011,"Renewable and Sustainable Energy Reviews","15","4",,"1801","1809",,20,10.1016/j.rser.2010.11.033,"https://www.scopus.com/inward/record.uri?eid=2-s2.0-79851508581&partnerID=40&md5=87ffd4fcf1085aa05a9c613942abdd3c",Article,Scopus,2-s2.0-79851508581
"Lóczy, D., Gyenizse, P.","Fluvial micromorphology influenced by tillage on a Danubian floodplain in Hungary",2011,"Zeitschrift fur Geomorphologie","55","SUPPL. 1",,"67","76",,1,10.1127/0372-8854/2011/0055S1-0038,"https://www.scopus.com/inward/record.uri?eid=2-s2.0-79954587385&partnerID=40&md5=fdef17645ac762fd88f6c157db9e7f59",Conference Paper,Scopus,2-s2.0-79954587385
"Pekeč, S., Belić, M., Neši, L., Orlović, S., Ivanišević, P.","Water physical properties of eugley in a protected part of alluvial plains of the Central Danube Basin",2011,"African Journal of Agricultural Research","6","7",,"1717","1725",,3,,"https://www.scopus.com/inward/record.uri?eid=2-s2.0-79956321478&partnerID=40&md5=2ea8504f45cf33a67d3b4fb5d7691e02",Article,Scopus,2-s2.0-79956321478
"Schipper, J.W., Frueh, B., Pfeiffer, A., Zaengl, G.","Wind direction-dependent statistical downscaling of precipitation applied to the Upper Danube catchment",2011,"International Journal of Climatology","31","4",,"578","591",,2,10.1002/joc.2084,"https://www.scopus.com/inward/record.uri?eid=2-s2.0-79952298584&partnerID=40&md5=6b1c06a7670203b8d70369bd2584720c",Article,Scopus,2-s2.0-79952298584
"van Assche, K., Duineveld, M., Beunen, R., Teampau, P.","Delineating locals: Transformations of knowledge/power and the governance of the danube delta",2011,"Journal of Environmental Policy and Planning","13","1",,"1","21",,24,10.1080/1523908X.2011.559087,"https://www.scopus.com/inward/record.uri?eid=2-s2.0-79953196539&partnerID=40&md5=1b2a747d40b8c750d1c2281fcd3bf21b",Article,Scopus,2-s2.0-79953196539
"Licurici, M., Boengiu, S., Ionuş, O.","Natural and man-induced hazards along the Danube, between Rast and Gighera settlements, with a special view on the 2006 flood",2011,"Quaestiones Geographicae","30","1",,"57","68",,1,10.2478/v10117-011-0005-1,"https://www.scopus.com/inward/record.uri?eid=2-s2.0-79953326349&partnerID=40&md5=49a751e51ef6707d4f8e844c0e5c73c4",Article,Scopus,2-s2.0-79953326349
"Ilić, M., Antić, M., Antić, V., Schwarzbauer, J., Vrvić, M., Jovančićević, B.","Investigation of bioremediation potential of zymogenous bacteria and fungi for crude oil degradation",2011,"Environmental Chemistry Letters","9","1",,"133","140",,6,10.1007/s10311-009-0257-3,"https://www.scopus.com/inward/record.uri?eid=2-s2.0-79952071555&partnerID=40&md5=8955eee2979c2d63e1d895e675a53662",Article,Scopus,2-s2.0-79952071555
"Lanszki, J., Mórocz, A., Conroy, J.W.H.","Food caching by a Eurasian otter",2011,"Folia Zoologica","60","1",,"43","46",,,,"https://www.scopus.com/inward/record.uri?eid=2-s2.0-79952832679&partnerID=40&md5=70d13284b30cc986d48f13962203259a",Article,Scopus,2-s2.0-79952832679
"Zorić, K., Jakovčev-Todorović, D., Dikanović, V., Vasiljević, B., Tomović, J., Atanacković, A., Simić, V., Paunović, M.","Distribution of the Ponto-Caspian polychaeta Hypania invalida (Grube, 1860) in inland waters of Serbia",2011,"Aquatic Invasions","6","1",,"33","38",,2,10.3391/ai.2011.6.1.04,"https://www.scopus.com/inward/record.uri?eid=2-s2.0-80053962829&partnerID=40&md5=89629c1a5df3faf0ce4a52a56e0c021e",Article,Scopus,2-s2.0-80053962829
"Dan, S., Walstra, D.J.R., Stive, M.J.F., Panin, N.","Processes controlling the development of a river mouth spit",2011,"Marine Geology","280","1-4",,"116","129",,16,10.1016/j.margeo.2010.12.005,"https://www.scopus.com/inward/record.uri?eid=2-s2.0-79951672958&partnerID=40&md5=0ca7b1d2449f5516ed0e5f0945032e88",Article,Scopus,2-s2.0-79951672958
"Micić, V., Kruge, M.A., Köster, J., Hofmann, T.","Natural, anthropogenic and fossil organic matter in river sediments and suspended particulate matter: A multi-molecular marker approach",2011,"Science of the Total Environment","409","5",,"905","919",,16,10.1016/j.scitotenv.2010.11.009,"https://www.scopus.com/inward/record.uri?eid=2-s2.0-78651429875&partnerID=40&md5=9266d5ebc16588cfcf1b450de7fef52c",Article,Scopus,2-s2.0-78651429875
"Pinhasi, R., Stefanović, S., Papathanasiou, A., Stock, J.T.","Variability in Long Bone Growth Patterns and Limb Proportions within and Amongst Mesolithic and Neolithic Populations from Southeast Europe",2011,"Human Bioarchaeology of the Transition to Agriculture",,,,"177","202",,9,10.1002/9780470670170.ch8,"https://www.scopus.com/inward/record.uri?eid=2-s2.0-84857235303&partnerID=40&md5=15bae5a80fbe866046597f24dc37c9c4",Book Chapter,Scopus,2-s2.0-84857235303
"Weiss, S., Marić, S., Snoj, A.","Regional structure despite limited mtDNA sequence diversity found in the endangered Huchen, Hucho hucho (Linnaeus, 1758)",2011,"Hydrobiologia","658","1",,"103","110",,13,10.1007/s10750-010-0453-y,"https://www.scopus.com/inward/record.uri?eid=2-s2.0-79959779167&partnerID=40&md5=db1185e766c17de9cbdb0acdec18b1ec",Article,Scopus,2-s2.0-79959779167
"Tsymbalyuk, K.K., Den’ga, Y.M., Berlinsky, N.A., Antonovich, V.P.","Determination of 16 priority polycyclic aromatic hydrocarbons in bottom sediments of the danube estuarine coast by GC/MS",2011,"Geo-Eco-Marina","17",,,"67","72",,3,,"https://www.scopus.com/inward/record.uri?eid=2-s2.0-84884818940&partnerID=40&md5=a18fc100534952043131c8fdf0db9b12",Article,Scopus,2-s2.0-84884818940
"Rădan, S.-C., Rădan, S.","Recent sediments as enviromagnetic archives. A brief overview",2011,"Geo-Eco-Marina","17",,,"103","122",,2,,"https://www.scopus.com/inward/record.uri?eid=2-s2.0-84923610220&partnerID=40&md5=6d70441f2dcb77634e57dc2ec20873e1",Article,Scopus,2-s2.0-84923610220
"Ghişa, A.","Stages in the institutional establishment of Danube Cooperation: From the European Commission of the Danube to the Danube Commission",2010,"Transylvanian Review","19","4",,"130","140",,,,"https://www.scopus.com/inward/record.uri?eid=2-s2.0-79251591647&partnerID=40&md5=2590da2a55f4f4f9dab5a3c1db8a5f44",Review,Scopus,2-s2.0-79251591647
"Goda, L.","The fords of the Danube",2010,"Hydrological Processes of the Danube River Basin: Perspectives from the Danubian Countries",,,,"343","366",,,10.1007/978-90-481-3423-6_11,"https://www.scopus.com/inward/record.uri?eid=2-s2.0-84891986484&partnerID=40&md5=112fffeb9d80092b3be436bc375b3a1e",Book Chapter,Scopus,2-s2.0-84891986484
