Authors,Title,Year,Source title,Volume,Issue,Art. No.,Page start,Page end,Page count,Cited by,DOI,Link,Document Type,Source,EID
"Balteanu, D., Dogaru, D., Dragota, C., Grigorescu, I., Dumitrascu, M., Corbu, A., Sima, M., Kucsicsa, G., Calin, D.","Dryness and drought phenomena in the Danube floodplain: The Calafat - Turnu Magurele sector. a local community-based participatory approach",2013,"International Multidisciplinary Scientific GeoConference Surveying Geology and Mining Ecology Management, SGEM","1",,,"291","298",,,10.5593/SGEM2013/BE5.V1/S20.039,"https://www.scopus.com/inward/record.uri?eid=2-s2.0-84892583797&partnerID=40&md5=c4e7112c7bd2c0306507fbb57054733c",Conference Paper,Scopus,2-s2.0-84892583797
"Dumitrascu, M., Grigorescu, I., Doroftei, M., Kucsicsa, G., Mierla, M., Dragota, C.-S., Nastase, M.","Assessing invasive terrestrial plan species Amorpha fruticosa in three wetland areas in Romania: Danube delta biosphere reserve, comana natural park and mures floodplain natural park",2013,"International Multidisciplinary Scientific GeoConference Surveying Geology and Mining Ecology Management, SGEM","1",,,"113","124",,1,10.5593/SGEM2013/BE5.V1/S20.016,"https://www.scopus.com/inward/record.uri?eid=2-s2.0-84892600035&partnerID=40&md5=aadc8cfe4247ac7de4876b0dc1745507",Conference Paper,Scopus,2-s2.0-84892600035
"Grigorescu, I., Dragota, C., Kucsicsa, G., Nikolova, M.","Joint assessment of climate hazards in the Danube Floodplain: The Calafat-Vidin - Turnu Mǎgurele-Nikopole sector. A preliminary approach",2013,"International Multidisciplinary Scientific GeoConference Surveying Geology and Mining Ecology Management, SGEM",,,,"689","695",,,10.5593/SGEM2013/BD4/S19.024,"https://www.scopus.com/inward/record.uri?eid=2-s2.0-84892620415&partnerID=40&md5=bf885ace7389a915d675bc3e6f17e40c",Conference Paper,Scopus,2-s2.0-84892620415
"Roche, K.F., Janač, M., Jurajda, P.","A review of Gobiid expansion along the Danube-Rhine corridor-geopolitical change as a driver for invasion",2013,"Knowledge and Management of Aquatic Ecosystems",,"411", 01,"","",,30,10.1051/kmae/2013066,"https://www.scopus.com/inward/record.uri?eid=2-s2.0-84887982340&partnerID=40&md5=6198c122063ffaeb8b23b408005525e3",Review,Scopus,2-s2.0-84887982340
"Sǎcǎrin, C., Berzovan, A., Borangic, C.","A fort at the edge of the empire. observations enabled by the discovery of two curved weapons at the Dacian fortress of Divici",2013,"Annales d'Universite 'Valahia' Targoviste, Section d'Archeologie et d'Histoire","15","1",,"55","75",,,,"https://www.scopus.com/inward/record.uri?eid=2-s2.0-84887967264&partnerID=40&md5=aec5132957f10f883c66d795b0b0bd9e",Article,Scopus,2-s2.0-84887967264
"Constantinescu, D.","Roman defence sites on the Danube river and environmental changes",2013,"WIT Transactions on the Built Environment","131",,,"563","577",,1,10.2495/STR130471,"https://www.scopus.com/inward/record.uri?eid=2-s2.0-84887601400&partnerID=40&md5=d025359e15accfeafc1b88c96dd084d3",Conference Paper,Scopus,2-s2.0-84887601400
"Rakovic, M., Popovic, N., Kalafatic, V., Martinovic-Vitanovic, V.","Spreading of Dreissena rostriformis bugensis (Andrusov, 1897) in the Danube River (Serbia)",2013,"Acta Zoologica Bulgarica","65","3",,"349","357",,2,,"https://www.scopus.com/inward/record.uri?eid=2-s2.0-84887210783&partnerID=40&md5=6d34f6fb1805c43ffed9d969a1a31260",Article,Scopus,2-s2.0-84887210783
"Naumov, B., Biserkov, V.","On the distribution and subspecies affiliation of Triturus dobrogicus (Amphibia: Salamandridae) in Bulgaria",2013,"Acta Zoologica Bulgarica","65","3",,"307","313",,1,,"https://www.scopus.com/inward/record.uri?eid=2-s2.0-84887179036&partnerID=40&md5=ee98ed97fb0c23d1ef3af0f2a6993ea0",Article,Scopus,2-s2.0-84887179036
"Hubenov, Z., Trichkova, T., Kenderov, L., Kozuharov, D.","Distribution of Corbicula fluminea (Mollusca: Corbiculidae) over an eleven-year period of its invasion in Bulgaria",2013,"Acta Zoologica Bulgarica","65","3",,"315","326",,5,,"https://www.scopus.com/inward/record.uri?eid=2-s2.0-84887165781&partnerID=40&md5=b8628d0fd8903791a111077db2e2ec3f",Article,Scopus,2-s2.0-84887165781
"Trichkova, T., Tyufekchieva, V., Kenderov, L., Vidinova, Y., Botev, I., Kozuharov, D., Hubenov, Z., Uzunov, Y., Stoichev, S., Cheshmedjiev, S.","Benthic macroinvertebrate diversity in relation to environmental parameters, and ecological potential of reservoirs, Danube river basin, North-West Bulgaria",2013,"Acta Zoologica Bulgarica","65","3",,"337","348",,4,,"https://www.scopus.com/inward/record.uri?eid=2-s2.0-84887166048&partnerID=40&md5=7e7f8411e18011213a1f18e0e897fe21",Article,Scopus,2-s2.0-84887166048
"Kozuharov, D., Trichkova, T., Stanachkova, M., Borisova, P., Botev, I.","Comparative analysis of zooplankton composition in reservoirs of north-west Bulgaria: Relation to water physicochemical parameters and dreissena infestation",2013,"Acta Zoologica Bulgarica","65","3",,"359","370",,6,,"https://www.scopus.com/inward/record.uri?eid=2-s2.0-84887132930&partnerID=40&md5=4a249b6da80ffd0849d79546a57a8fda",Article,Scopus,2-s2.0-84887132930
"Pavlova, M., Ihtimanska, M., Dedov, I., Biserkov, V., Uzunov, Y., Pehlivanov, L.","New localities of Theodoxus transversalis (C. Pfeiffer, 1828) within European natura 2000 network on the islands of the lower Danube river",2013,"Acta Zoologica Bulgarica","65","1",,"121","123",,3,,"https://www.scopus.com/inward/record.uri?eid=2-s2.0-84887055684&partnerID=40&md5=d633148b2786137c17080462efb8df1f",Article,Scopus,2-s2.0-84887055684
"Nagy, A.S., Szabó, J., Vass, I.","Trace metal and metalloid levels in surface water of Marcal River before and after the Ajka red mud spill, Hungary",2013,"Environmental Science and Pollution Research","20","11",,"7603","7614",,4,10.1007/s11356-013-2071-5,"https://www.scopus.com/inward/record.uri?eid=2-s2.0-84885942010&partnerID=40&md5=74378d4d620d8821d8731bcf7ab03cca",Article,Scopus,2-s2.0-84885942010
"Hamchevici, C., Udrea, I.","Improving the sampling strategy of the Joint Danube Survey 3 (2013) by means of multivariate statistical techniques applied on selected physico-chemical and biological data",2013,"Environmental Monitoring and Assessment","185","11",,"9495","9507",,1,10.1007/s10661-013-3268-2,"https://www.scopus.com/inward/record.uri?eid=2-s2.0-84885460164&partnerID=40&md5=98d4a99c200a1807de2bb7a65506bdb0",Article,Scopus,2-s2.0-84885460164
"Djikanović, V., Marković, G., Škorić, S.","New record of Neogobius fluviatilis (Pallas, 1814) (Gobiidae) in the Danube River Basin (Serbia)",2013,"Archives of Biological Sciences","65","4",,"1469","1472",,1,10.2298/ABS1304469D,"https://www.scopus.com/inward/record.uri?eid=2-s2.0-84884689845&partnerID=40&md5=354d65cfb403e265a85f819a2bfd1ef8",Article,Scopus,2-s2.0-84884689845
"Mihaljević, M., Špoljarić, D., Stević, F., Žuna Pfeiffer, T.","Assessment of flood-induced changes of phytoplankton along a river-floodplain system using the morpho-functional approach",2013,"Environmental Monitoring and Assessment","185","10",,"8601","8619",,5,10.1007/s10661-013-3198-z,"https://www.scopus.com/inward/record.uri?eid=2-s2.0-84884349757&partnerID=40&md5=32d821c77afd5a534847dfe37e171271",Article,Scopus,2-s2.0-84884349757
"Katalin, T.B., Sándor, J., Katalin, J.S., Zsuzsanna, M.V.","Danube: The big prehistoric conveyor belt [Duna: a nagy szállítószalag]",2013,"Archeometriai Muhely","10","1",,"33","50",,,,"https://www.scopus.com/inward/record.uri?eid=2-s2.0-84884400052&partnerID=40&md5=f51a1bced037db0205174d20f0540379",Article,Scopus,2-s2.0-84884400052
"Povinec, P.P., Ženišová, Z., Šivo, A., Ogrinc, N., Richtáriková, M., Breier, R.","Radiocarbon and stable isotopes as groundwater tracers in the Danube river basin of SW Slovakia",2013,"Radiocarbon","55","2-3",,"1017","1028",,1,10.2458/azu_js_rc.55.16261,"https://www.scopus.com/inward/record.uri?eid=2-s2.0-84884393622&partnerID=40&md5=e7a1a07fc3031c520e1f1cd0523ed5f6",Article,Scopus,2-s2.0-84884393622
"Števove, B., Kováč, V.","Do invasive bighead goby Neogobius kessleri and round goby N. melanostomus (Teleostei, Gobiidae) compete for food?",2013,"Knowledge and Management of Aquatic Ecosystems",,"410", 3,"","",,4,10.1051/kmae/2013064,"https://www.scopus.com/inward/record.uri?eid=2-s2.0-84884142092&partnerID=40&md5=38355f83c96bf776f8af5b4f891b0329",Article,Scopus,2-s2.0-84884142092
"Stoica, C., Stanescu, E., Lucaciu, I., Gheorghe, St., Nicolau, M.","Influence of global change on biological assemblages in the Danube delta",2013,"Journal of Environmental Protection and Ecology","14","2",,"468","479",,6,,"https://www.scopus.com/inward/record.uri?eid=2-s2.0-84883499912&partnerID=40&md5=784fb9e949709b4efad80196c6df6ccf",Article,Scopus,2-s2.0-84883499912
"Stanescu, E., Stoica, C., Vasile, G., Petre, J., Gheorghe, S., Paun, I., Lucaciu, I., Nicolau, M., Vosniakos, F., Vosniakos, K., Golumbeanu, M.","Structural Changes of Biological Compartments in Danube Delta Systems Due to Persistent Organic Pollutants and Toxic Metals",2013,"NATO Science for Peace and Security Series C: Environmental Security","134",,,"229","248",,,10.1007/978-94-007-6461-3_21,"https://www.scopus.com/inward/record.uri?eid=2-s2.0-84883382461&partnerID=40&md5=39a52cbcf0e5bfb85fffaabb82440f25",Article,Scopus,2-s2.0-84883382461
"Simeonova, B.G., Dura, G., Simeonov, L.I.","The Danube Regional Pesticide Study Project 1995-1997: A Brief Synthesis of the Results",2013,"NATO Science for Peace and Security Series C: Environmental Security","134",,,"405","411",,,10.1007/978-94-007-6461-3_36,"https://www.scopus.com/inward/record.uri?eid=2-s2.0-84883312934&partnerID=40&md5=f91b06d29d7900cdc51ec9015d97b23e",Article,Scopus,2-s2.0-84883312934
"Pekeč, S., Vrbek, B., Orlović, S., Ballian, D.","Water dynamics and physical characteristics of hydromorphic soils in southern Bačka",2013,"Periodicum Biologorum","115","3",,"","",,1,,"https://www.scopus.com/inward/record.uri?eid=2-s2.0-84890021417&partnerID=40&md5=5abf99d32b50af0669ddc80cbc73cc0d",Article,Scopus,2-s2.0-84890021417
"Milana, P., Dragan, D., Uglješa, S., Igor, L.","Correlation analysis of impact of natural parameters on water quality of the river danube near Novi Sad for the period 2004-2011",2013,"Geographica Pannonica","17","3",,"74","78",,1,,"https://www.scopus.com/inward/record.uri?eid=2-s2.0-84889563345&partnerID=40&md5=0b3f4d635a31abf61268ab50101f2a52",Article,Scopus,2-s2.0-84889563345
"Pašiaková, M., Gajdoš, V., Bučová, J., Brixová, B., Bielik, M.","Geophysical image of sedimentary infill structure of the Danube Basin along the profile between Dunajská Streda - Velký Meder: Reinterpretation of geoelectrical data of vertical electrical sounding [Geofyzikálny obraz stavby sedimentárnej výplne Dunajskej panvy pozdÍž profilu medzi Dunajskou Stredou a Velkým Mederom: Reinterpretácia geoelektrických údajov vertikálneho elektrického sondovania]",2013,"Acta Geologica Slovaca","5","1",,"45","54",,,,"https://www.scopus.com/inward/record.uri?eid=2-s2.0-84882968434&partnerID=40&md5=ab897aa14af7322c42311ef86c358130",Article,Scopus,2-s2.0-84882968434
"Faludi, T., Andrási, N., Vasanits-Zsigrai, A., Záray, G., Molnár-Perl, I.","Systematic derivatization, mass fragmentation and acquisition studies in the analysis of chlorophenols, as their silyl derivatives by gas chromatography-mass spectrometry",2013,"Journal of Chromatography A","1302",,,"133","142",,11,10.1016/j.chroma.2013.06.004,"https://www.scopus.com/inward/record.uri?eid=2-s2.0-84880307851&partnerID=40&md5=8c1ac21298cbf0ae71ab8f99200222df",Article,Scopus,2-s2.0-84880307851
"Agalareva, M.N.","State and dynamics of erosion-accumulative processes along the Bulgarian Danube riverside",2013,"Comptes Rendus de L'Academie Bulgare des Sciences","66","8",,"1159","1166",,,,"https://www.scopus.com/inward/record.uri?eid=2-s2.0-84881056198&partnerID=40&md5=e97fe316597af6eb4836a877f72efce8",Article,Scopus,2-s2.0-84881056198
"Vignati, D.A.L., Secrieru, D., Bogatova, Y.I., Dominik, J., Céréghino, R., Berlinsky, N.A., Oaie, G., Szobotka, S., Stanica, A.","Trace element contamination in the arms of the Danube Delta (Romania/Ukraine): Current state of knowledge and future needs",2013,"Journal of Environmental Management","125",,,"169","178",,1,10.1016/j.jenvman.2013.04.007,"https://www.scopus.com/inward/record.uri?eid=2-s2.0-84877315248&partnerID=40&md5=253ce93a4011f9f738baa9d394a98a4c",Article,Scopus,2-s2.0-84877315248
"Micić, V., Kruge, M.A., Hofmann, T.","Variations of common riverine contaminants in reservoir sediments",2013,"Science of the Total Environment","458-460",,,"90","100",,7,10.1016/j.scitotenv.2013.03.102,"https://www.scopus.com/inward/record.uri?eid=2-s2.0-84877136850&partnerID=40&md5=b7c126ebfce8fc2c6bdda048495f9630",Article,Scopus,2-s2.0-84877136850
"Schöll, K., Devetter, M.","Soil rotifers new to Hungary from the Gemenc floodplain (Duna-Dráva National Park, Hungary)",2013,"Turkish Journal of Zoology","37","4",,"406","412",,1,10.3906/zoo-1209-27,"https://www.scopus.com/inward/record.uri?eid=2-s2.0-84879519159&partnerID=40&md5=cb497f67e844f23be1b4afa6fb45cc36",Article,Scopus,2-s2.0-84879519159
"Lyashenko, A.V., Zorina-Sakharova, Ye.Ye., Sanzhak, Yu.O., Makovskiy, V.V.","Comparative characteristics of the taxonomic composition of the macrofauna of the Kiliya delta of the Danube River",2013,"Hydrobiological Journal","49","3",,"27","40",,,10.1615/HydrobJ.v49.i3.30,"https://www.scopus.com/inward/record.uri?eid=2-s2.0-84879335918&partnerID=40&md5=65b47e7166ee08a6438c087fa12e0456",Article,Scopus,2-s2.0-84879335918
"Andrási, N., Molnár, B., Dobos, B., Vasanits-Zsigrai, A., Záray, G., Molnár-Perl, I.","Determination of steroids in the dissolved and in the suspended phases of wastewater and Danube River samples by gas chromatography, tandem mass spectrometry",2013,"Talanta","115",,,"367","373",,12,10.1016/j.talanta.2013.05.029,"https://www.scopus.com/inward/record.uri?eid=2-s2.0-84879090754&partnerID=40&md5=db6b5d8078bdaf2a34779849f2a27ea9",Article,Scopus,2-s2.0-84879090754
"Deac, D.","Drei Neue Ägyptische Ushabti-Statuetten von Aquincum (Pannonia Inferior)",2013,"Acta Archaeologica Academiae Scientiarum Hungaricae","64","1",,"131","138",,,10.1556/AArch.64.2013.1.6,"https://www.scopus.com/inward/record.uri?eid=2-s2.0-84880012863&partnerID=40&md5=7a53459105410e1a9815f76e7380ff15",Article,Scopus,2-s2.0-84880012863
"Nagy, A.S., Simon, G., Szabó, J., Vass, I.","Polycyclic aromatic hydrocarbons in surface water and bed sediments of the Hungarian upper section of the Danube River",2013,"Environmental Monitoring and Assessment","185","6",,"4619","4631",,7,10.1007/s10661-012-2892-6,"https://www.scopus.com/inward/record.uri?eid=2-s2.0-84879053421&partnerID=40&md5=62e558835625ed3a4a47e206a2f25876",Article,Scopus,2-s2.0-84879053421
"Lindner, K., Cerwenka, A.F., Brandner, J., Gertzen, S., Borcherding, J., Geist, J., Schliewen, U.K.","First evidence for interspecific hybridization between invasive goby species Neogobius fluviatilis and Neogobius melanostomus (Teleostei: Gobiidae: Benthophilinae)",2013,"Journal of Fish Biology","82","6",,"2128","2134",,3,10.1111/jfb.12127,"https://www.scopus.com/inward/record.uri?eid=2-s2.0-84878804954&partnerID=40&md5=bdbf86a1e849bed3a2b18dbc19bc12c9",Article,Scopus,2-s2.0-84878804954
"Beškoski, V.P., Takemine, S., Nakano, T., Slavković Beškoski, L., Gojgić-Cvijović, G., Ilić, M., Miletić, S., Vrvić, M.M.","Perfluorinated compounds in sediment samples from the wastewater canal of Pančevo (Serbia) industrial area",2013,"Chemosphere","91","10",,"1408","1415",,15,10.1016/j.chemosphere.2012.12.079,"https://www.scopus.com/inward/record.uri?eid=2-s2.0-84876449466&partnerID=40&md5=ab609e20c7fc9bac74f2346801341325",Article,Scopus,2-s2.0-84876449466
"Bucha, T., Slávik, M., Hatala, N., Bartko, M.","Evaluation of forest health condition in the inundation area of Danube, section Dobrohošt - Sap from aerial multispectral images in 2011 [Zhodnotenie zdravotného stavu lesov v inundanej oblasti dunaja v úseku dobrohoŝt-sap z leteckých multispektrálnych snímok z roku 2011]",2013,"Forestry Journal","59","2",,"95","106",,,10.2478/v10114-011-0021-z,"https://www.scopus.com/inward/record.uri?eid=2-s2.0-84897728038&partnerID=40&md5=f32af44fe5fba39dabbacfe674d79451",Article,Scopus,2-s2.0-84897728038
"Catianis, I., Rǎdan, S., Grosu, D.","Distribution of lithological components of recent sediments from some lakes in the danube delta; environmental significance",2013,"Carpathian Journal of Earth and Environmental Sciences","8","2",,"55","68",,3,,"https://www.scopus.com/inward/record.uri?eid=2-s2.0-84878185549&partnerID=40&md5=06269fbbfd4043873dd4979cf9c67c2a",Article,Scopus,2-s2.0-84878185549
"Muftuoglu, A.E.","Transportation of pollutants of the danube river into the (western) black sea",2013,"Asian Journal of Chemistry","25","9",,"5013","5018",,,,"https://www.scopus.com/inward/record.uri?eid=2-s2.0-84878129221&partnerID=40&md5=f0c14c3be562d519837625add7a67b23",Article,Scopus,2-s2.0-84878129221
"Güttler, F.N., Niculescu, S., Gohin, F.","Turbidity retrieval and monitoring of Danube Delta waters using multi-sensor optical remote sensing data: An integrated view from the delta plain lakes to the western-northwestern Black Sea coastal zone",2013,"Remote Sensing of Environment","132",,,"86","101",,11,10.1016/j.rse.2013.01.009,"https://www.scopus.com/inward/record.uri?eid=2-s2.0-84873487770&partnerID=40&md5=e6f2dd92e98a2fcacad2a5abb1668693",Article,Scopus,2-s2.0-84873487770
"Bogatova, Y.I.","Hydrochemical regime of the Ukrainian part of Danube nearshore area",2013,"Water Resources","40","3",,"305","314",,,10.1134/S0097807813030020,"https://www.scopus.com/inward/record.uri?eid=2-s2.0-84877802528&partnerID=40&md5=3688a99b797cf601769ebb6e964c122c",Article,Scopus,2-s2.0-84877802528
"Rohr, C.","Floods of the upper Danube river and its tributaries and their impact on urban economies (c. 1350-1600): The examples of the towns of Krems/Stein and Wels (Austria)",2013,"Environment and History","19","2",,"133","148",,5,10.3197/096734013X13642082568534,"https://www.scopus.com/inward/record.uri?eid=2-s2.0-84875774485&partnerID=40&md5=221f11067a4874b543c87a5c26c18ed3",Article,Scopus,2-s2.0-84875774485
"Diachenko, T.N., Liashenko, A.V.","The giant reed (Arundo donax) in the Kiliya Danube delta",2013,"Hydrobiological Journal","49","1",,"109","112",,,10.1615/HydrobJ.v49.i1.100,"https://www.scopus.com/inward/record.uri?eid=2-s2.0-84876533767&partnerID=40&md5=43af5af4b7ef529df9c3ce6870449215",Article,Scopus,2-s2.0-84876533767
"Dzhurtubayev, M.M., Zamorov, V.V., Dzhurtubayev, Yu.M.","Modern state of macrozoobenthos of the Danube River lakes of the Odessa region. Report 1",2013,"Hydrobiological Journal","49","2",,"32","38",,,10.1615/HydrobJ.v49.i2.30,"https://www.scopus.com/inward/record.uri?eid=2-s2.0-84876515528&partnerID=40&md5=b1a9804138a12e15258c98614f1b9f01",Article,Scopus,2-s2.0-84876515528
"Bjelajac, Z., Pocuca, M., Mijatovic, M.D.","Industrial accident as a source of jeopardising the safety of people and environment with a special review of the case study 'accident in the middle section of the Danube river'",2013,"Journal of Environmental Protection and Ecology","14","1",,"35","48",,2,,"https://www.scopus.com/inward/record.uri?eid=2-s2.0-84876493833&partnerID=40&md5=8a330dc195a865166abee5b5d27de32d",Article,Scopus,2-s2.0-84876493833
"Schmutz, S., Kremser, H., Melcher, A., Jungwirth, M., Muhar, S., Waidbacher, H., Zauner, G.","Ecological effects of rehabilitation measures at the Austrian Danube: a meta-analysis of fish assemblages",2013,"Hydrobiologia",,,,"1","12",,2,10.1007/s10750-013-1511-z,"https://www.scopus.com/inward/record.uri?eid=2-s2.0-84875956389&partnerID=40&md5=9404ea959c6e05cd38cd8aaaf13dc31c",Article in Press,Scopus,2-s2.0-84875956389
"Lericolais, G., Bourget, J., Popescu, I., Jermannaud, P., Mulder, T., Jorry, S., Panin, N.","Late Quaternary deep-sea sedimentation in the western Black Sea: New insights from recent coring and seismic data in the deep basin",2013,"Global and Planetary Change","103",,,"232","247",,13,10.1016/j.gloplacha.2012.05.002,"https://www.scopus.com/inward/record.uri?eid=2-s2.0-84878215387&partnerID=40&md5=bf3a724dfac5c15b464a22523495e583",Article,Scopus,2-s2.0-84878215387
"Poncos, V., Teleaga, D., Bondar, C., Oaie, G.","A new insight on the water level dynamics of the Danube Delta using a high spatial density of SAR measurements",2013,"Journal of Hydrology","482",,,"79","91",,6,10.1016/j.jhydrol.2012.12.037,"https://www.scopus.com/inward/record.uri?eid=2-s2.0-84873569158&partnerID=40&md5=446cbceabec183d645ce2cc26bad77ad",Article,Scopus,2-s2.0-84873569158
"Jurajda, P., Všetičková, L., Polačik, M., Vassilev, M.","Can round goby (Neogobius melanostomus) caught by rod and line be used for diet analysis?",2013,"Journal of Great Lakes Research","39","1",,"182","185",,,10.1016/j.jglr.2012.12.002,"https://www.scopus.com/inward/record.uri?eid=2-s2.0-84873748249&partnerID=40&md5=5d680f6f8a00b6b24b6624276e592851",Article,Scopus,2-s2.0-84873748249
"Habersack, H., Gerstl, M., Glössl, J.","The Danube is a lifeline. Sustainable river basin management requires international Co-operation [Lebensader Donau: Nachhaltiges Flussgebietsmanagement benötigt internationale Koordination]",2013,"GAIA","22","1",,"67","69",,,,"https://www.scopus.com/inward/record.uri?eid=2-s2.0-84875480609&partnerID=40&md5=8452c4ef328dd1fbe4dd2b4da5edc7e2",Article,Scopus,2-s2.0-84875480609
"Tubić, B.P., Simić, V.M., Zorić, K.S., Gačić, Z.M., Atanacković, A.D., Csányi, B.J., Paunović, M.M.","Stream section types of the Danube River in Serbia according to the distribution of macroinvertebrates",2013,"Biologia (Poland)","68","2",,"294","302",,4,10.2478/s11756-013-0152-z,"https://www.scopus.com/inward/record.uri?eid=2-s2.0-84874317467&partnerID=40&md5=e7cf5b3972223c1e5219aad7b48246d1",Article,Scopus,2-s2.0-84874317467
"Radu, V.-M., Diacu, E., Varduca, A.","Development of procedures for hydrochemical monitoring data integration for the danube river related to the hydrological conditions",2013,"Revista de Chimie","64","3",,"242","245",,9,,"https://www.scopus.com/inward/record.uri?eid=2-s2.0-84877607477&partnerID=40&md5=e27f6808debe10976bb8e52a8d5a8cd1",Article,Scopus,2-s2.0-84877607477
"Heiler, K.C.M., de, A.B., Ekschmitt, K., von Oheimb, P.V., Albrecht, C., Wilke, T.","Reconstruction of the early invasion history of the quagga mussel (Dreissena rostriformis bugensis) in Western Europe",2013,"Aquatic Invasions","8","1",,"53","57",,9,10.3391/ai.2013.8.1.06,"https://www.scopus.com/inward/record.uri?eid=2-s2.0-84875606787&partnerID=40&md5=84dbbef995416e7b639a04218a39f1d4",Article,Scopus,2-s2.0-84875606787
"Oltean, I.A.","Burial mounds and settlement patterns: A quantitative approach to their identification from the air and interpretation",2013,"Antiquity","87","335",,"202","219",,,,"https://www.scopus.com/inward/record.uri?eid=2-s2.0-84875283255&partnerID=40&md5=d4d29c9d7bbec4d6b7b47223cc57e0d2",Article,Scopus,2-s2.0-84875283255
"Goedde, L.O.","Renaissance Landscapes: Discovering the World and Human Nature",2013,"Companion to Renaissance and Baroque Art, A",,,,"381","401",,,10.1002/9781118391488.ch18,"https://www.scopus.com/inward/record.uri?eid=2-s2.0-84886116785&partnerID=40&md5=7f26892a8fc35326f59f0cb942c313d5",Book Chapter,Scopus,2-s2.0-84886116785
"Matenco, L., Andriessen, P., Andriessen, P.A.M., Avram, C., Bada, G., Beekman, F., Bielik, M., Ter Borgh, M., Cifci, G., Cvetković, V., Dinu, C., Dombradi, E., Dondurur, D., Ergun, M., Francu, J., Fügenschuh, B., Garcia-Castellanos, D., Götz, J., Horváth, F., Houseman, G., Knežević, S., Kovac, M., Kralikova, S., Krijgsman, W., Kucuk, M., Legosteva, O., Lericolais, G., Jipa, D., Matenco, L., Maximov, G., Melinte, M., Minar, J., Munteanu, I., Munt, I.J., Olariu, C., Otto, J.C., Panin, N., Plašienka, D., Reiser, M., Rundić, L., Rupprechter, M., Safanda, J., Schmid, S., Schrott, L., Schuster, R., Starostenko, V., Steel, R.J., Stephenson, R., Stovba, S., Sokoutis, D., Stankoviansky, M., Stoica, M., Stojadinović, U., Toljić, M., Tomljenović, B., Ter Voorde, M., Wong, H","Quantifying the mass transfer from mountain ranges to deposition in sedimentary basins: Source to sink studies in the danube basin-black sea system",2013,"Global and Planetary Change","103","1",,"1","18",,9,10.1016/j.gloplacha.2013.01.003,"https://www.scopus.com/inward/record.uri?eid=2-s2.0-84878230708&partnerID=40&md5=e4fe61b984c69b88fbce6d14a5c4aa72",Article,Scopus,2-s2.0-84878230708
"Safner, R., Treer, T., Aničić, I., Piria, M., Šprem, N., Matulic, D., Tomljanović, T.","First record of palmetto bass (morone saxatilis x m. chrysops) in the croatian part of the river danube",2013,"Archives of Biological Sciences","65","1",,"197","200",,2,10.2298/ABS1301197S,"https://www.scopus.com/inward/record.uri?eid=2-s2.0-84873197680&partnerID=40&md5=bf9b63ee0e0ed734cdcb7eb427c9b3a5",Article,Scopus,2-s2.0-84873197680
"Škraba, D., Tošić, A., Miličicć, D., Nikolicć, V., Simonovicć, P.","Invasiveness assessment of the Chinese mitten crab Eriocheir sinensis (H. Milne Edwards, 1853) in the Serbian section of the River Danube",2013,"Archives of Biological Sciences","65","1",,"353","358",,5,10.2298/ABS1301353S,"https://www.scopus.com/inward/record.uri?eid=2-s2.0-84873138820&partnerID=40&md5=09259ebf5bf4d6144d9a1a4994ff64a9",Article,Scopus,2-s2.0-84873138820
"Cowan, C.","Nature's technology: An ecosystem-based approach to adaptation",2013,"Climate Adaptation Futures",,,,"267","278",,,10.1002/9781118529577.ch25,"https://www.scopus.com/inward/record.uri?eid=2-s2.0-84886330696&partnerID=40&md5=033a8e649bccb76c83e6d1b5f972ac43",Book Chapter,Scopus,2-s2.0-84886330696
