Authors,Title,Year,Source title,Volume,Issue,Art. No.,Page start,Page end,Page count,Cited by,DOI,Link,Document Type,Source,EID
"Fröschl, L., Pierrard, R., Schönbäck, W.","Cost-efficient choice of measures in agriculture to reduce the nitrogen load flowing from the Danube River into the Black Sea. An analysis for Austria, Bulgaria, Hungary and Romania",2008,"Ecological Economics","68","1-2",,"96","105",,17,10.1016/j.ecolecon.2008.02.005,"https://www.scopus.com/inward/record.uri?eid=2-s2.0-53749086459&partnerID=40&md5=74b3b2a062f21bfe99e0e512f8c392b1",Article,Scopus,2-s2.0-53749086459
"Mihnea, I., Mǎndru, R., Bran, M.","Danube Dams - Necessity or calamity?",2008,"Carpathian Journal of Earth and Environmental Sciences","3","1",,"31","38",,9,,"https://www.scopus.com/inward/record.uri?eid=2-s2.0-62849125612&partnerID=40&md5=ebad654b46c066595968c8a7dcbd4857",Article,Scopus,2-s2.0-62849125612
"Pfleiderer, S.","Geostatistical analysis of elevation and lithology of quaternary terraces in Vienna (Austria)",2008,"Austrian Journal of Earth Sciences","101",,,"81","87",,1,,"https://www.scopus.com/inward/record.uri?eid=2-s2.0-60349128771&partnerID=40&md5=ae0be38a2297af3f8fd4d9d13349e10f",Article,Scopus,2-s2.0-60349128771
"Koščo, J., Lusk, S., Pekárik, L., Košuthová, L., Lusková, V., Košuth, P.","The occurrence and status of species of the genera Cobitis, Sabanejewia, and Misgurnus in Slovakia",2008,"Folia Zoologica","57","1-2",,"26","34",,4,,"https://www.scopus.com/inward/record.uri?eid=2-s2.0-70349639517&partnerID=40&md5=d085d52b1f59fecf6f02ce3c3cd88424",Article,Scopus,2-s2.0-70349639517
"Szmańda, J.B., Lehotský, M., Novotný, J.","Sedimentological record of flood events from years 2002 and 2007 in the Danube River overbank deposits in Bratislava (Slovakia)",2008,"Moravian Geographical Reports","16","4",,"25","32",,1,,"https://www.scopus.com/inward/record.uri?eid=2-s2.0-59849129878&partnerID=40&md5=6ae10d76384ee601a647e240efe956df",Article,Scopus,2-s2.0-59849129878
"Pišút, P.","Endagerment of the village Čunovo (Slovakia) by lateral erosion of the Danube river in the 18th century",2008,"Moravian Geographical Reports","16","4",,"33","44",,3,,"https://www.scopus.com/inward/record.uri?eid=2-s2.0-59849118267&partnerID=40&md5=bf79d790934433d1de5b6d8647b00e22",Article,Scopus,2-s2.0-59849118267
"Koyano, M.","The significance of the Convention on Environmental Impact Assessment in a Transboundary Context (Espoo Convention) in international environmental law: Examining the implications of the Danube Delta case",2008,"Impact Assessment and Project Appraisal","26","4",,"299","314",,8,10.3152/146155108X391600,"https://www.scopus.com/inward/record.uri?eid=2-s2.0-66649101592&partnerID=40&md5=3e6a2a2290c3dde0ccde4d7ec1693287",Article,Scopus,2-s2.0-66649101592
"Slobodnik, J., Dulio, V.","NORMAN - Network of Reference Laboratories for Monitoring of Emerging Substances",2008,"The Water Framework Directive: Ecological and Chemical Status Monitoring",,,,"355","369",,,10.1002/9780470716090.ch21,"https://www.scopus.com/inward/record.uri?eid=2-s2.0-84948783285&partnerID=40&md5=13976670c3d490322e1232d1d4b0592e",Book Chapter,Scopus,2-s2.0-84948783285
"Subakov-Simić, G., Karadžić, V., Krizmanić, J., Cvijan, M., Maljević, E.","Euglenophyta of the Danube River in Serbia",2008,"Archives of Biological Sciences","60","1",,"159","162",,1,10.2298/ABS0801159S,"https://www.scopus.com/inward/record.uri?eid=2-s2.0-53549087514&partnerID=40&md5=c0a593988bbdbd70640097ffd2dd0f0c",Article,Scopus,2-s2.0-53549087514
"Stamenković, M., Cvijan, M.","Desmid flora (Chlorophyta, Zygnematophyceae) of the Danube in the Province of Vojvodina (Northern Serbia)",2008,"Archives of Biological Sciences","60","2",,"181","199",,3,10.2298/ABS0802181S,"https://www.scopus.com/inward/record.uri?eid=2-s2.0-53549127809&partnerID=40&md5=843dc7bf0215730f651406a5660faa21",Article,Scopus,2-s2.0-53549127809
"Cakić, P.D., Djikanović, V.D.J., Kulišić, Z.B., Paunović, M.M., Jakovčev-Todorović, D.G., Milošević, S.M.","The fauna of endoparasites in Acipenser ruthenus Linnaeus, 1758 from the Serbian part of the Danube River",2008,"Archives of Biological Sciences","60","1",,"103","107",,2,10.2298/ABS0801103C,"https://www.scopus.com/inward/record.uri?eid=2-s2.0-53549086928&partnerID=40&md5=f318fa0b18f1d7748483b23b4bd7b165",Article,Scopus,2-s2.0-53549086928
"Hohensinner, S., Herrnegger, M., Blaschke, A.P., Habereder, C., Haidvogl, G., Hein, T., Jungwirth, M., Weiß, M.","Type-specific reference conditions of fluvial landscapes: A search in the past by 3D-reconstruction",2008,"Catena","75","2",,"200","215",,25,10.1016/j.catena.2008.06.004,"https://www.scopus.com/inward/record.uri?eid=2-s2.0-52349120756&partnerID=40&md5=642439acf13f7d9739d1164004304d8f",Article,Scopus,2-s2.0-52349120756
"Ocalewicz, K., Woznicki, P., Jankun, M.","Mapping of rRNA genes and telomeric sequences in Danube salmon (Hucho hucho) chromosomes using primed in situ labeling technique (PRINS)",2008,"Genetica","134","2",,"199","203",,9,10.1007/s10709-007-9225-7,"https://www.scopus.com/inward/record.uri?eid=2-s2.0-50249150913&partnerID=40&md5=3a9675ae04dedd97afc77bcb76cf5c76",Article,Scopus,2-s2.0-50249150913
"Klar, C.W., Fiener, P., Neuhaus, P., Lenz-Wiedemann, V.I.S., Schneider, K.","Modelling of soil nitrogen dynamics within the decision support system DANUBIA",2008,"Ecological Modelling","217","1-2",,"181","196",,15,10.1016/j.ecolmodel.2008.06.019,"https://www.scopus.com/inward/record.uri?eid=2-s2.0-48349133847&partnerID=40&md5=1f76160cdafb62e29850489ce5f76bbd",Article,Scopus,2-s2.0-48349133847
"Pajević, S., Borišev, M., Rončević, S., Vukov, D., Igić, R.","Heavy metal accumulation of Danube river aquatic plants - Indication of chemical contamination",2008,"Central European Journal of Biology","3","3",,"285","294",,25,10.2478/s11535-008-0017-6,"https://www.scopus.com/inward/record.uri?eid=2-s2.0-47349100675&partnerID=40&md5=7615d341e7710b1e44bdb524e8d8f395",Article,Scopus,2-s2.0-47349100675
"Zitek, A., Schmutz, S., Jungwirth, M.","Assessing the efficiency of connectivity measures with regard to the EU-Water Framework Directive in a Danube-tributary system",2008,"Hydrobiologia","609","1",,"139","161",,13,10.1007/s10750-008-9394-0,"https://www.scopus.com/inward/record.uri?eid=2-s2.0-45749113718&partnerID=40&md5=c39e5dccec343521a15d2f9fa8f3a759",Conference Paper,Scopus,2-s2.0-45749113718
"Debois, S.","Approach of funerary behaviours in the area of lower Danube by the end of Neolithic [Approche des comportements funéraires dans la région du Bas-Danube à la fin du Néolithique]",2008,"Anthropologie","112","4-5",,"661","690",,1,10.1016/j.anthro.2006.12.004,"https://www.scopus.com/inward/record.uri?eid=2-s2.0-56849099707&partnerID=40&md5=cdbe19e28ea00039a5b1e59749b14308",Article,Scopus,2-s2.0-56849099707
"Thierry, D., Paulian, M., Canard, M.","Comparison between green lacewing assemblages (Neuroptera: Chrysopidae) in the lower valleys of the Danube (Rumania) and the Loire (France)",2008,"Journal of the Entomological Research Society","10","2",,"43","53",,,,"https://www.scopus.com/inward/record.uri?eid=2-s2.0-48249148395&partnerID=40&md5=0abcd05164309546b0a48a43f8d96074",Article,Scopus,2-s2.0-48249148395
"Čápová, M., Zlatnická, I., Kováč, V., Katina, S.","Ontogenetic variability in the external morphology of monkey goby, Neogobius fluviatilis (Pallas, 1814) and its relevance to invasion potential",2008,"Hydrobiologia","607","1",,"17","26",,10,10.1007/s10750-008-9361-9,"https://www.scopus.com/inward/record.uri?eid=2-s2.0-44249095819&partnerID=40&md5=7b56f0730d0e48a4888d5e2b6f4f0eeb",Article,Scopus,2-s2.0-44249095819
"Zhylka, O.","Biological data on the Danube ruffe, Gymnocephalus baloni Holčík et Hensel, 1974, in the Desna River, Ukraine",2008,"Acta Ichthyologica et Piscatoria","38","1",,"45","46",,,10.3750/AIP2008.38.1.07,"https://www.scopus.com/inward/record.uri?eid=2-s2.0-45849133013&partnerID=40&md5=d801472e59981a1ec007b6228b596aa5",Article,Scopus,2-s2.0-45849133013
"Onderka, M., Pekárová, P.","Retrieval of suspended particulate matter concentrations in the Danube River from Landsat ETM data",2008,"Science of the Total Environment","397","1-3",,"238","243",,39,10.1016/j.scitotenv.2008.02.044,"https://www.scopus.com/inward/record.uri?eid=2-s2.0-43049098945&partnerID=40&md5=b7c2f27d66b364869747841cde113a8e",Article,Scopus,2-s2.0-43049098945
"Mihai, S.A., Georgescu, I.I.","Contributions to the database concerning the radioactivity of the Danube River and the black sea coast Romanian sector",2008,"Revista de Chimie","59","6",,"623","627",,,,"https://www.scopus.com/inward/record.uri?eid=2-s2.0-50649119491&partnerID=40&md5=d32be92f88e586133435b819c9d6dc9e",Article,Scopus,2-s2.0-50649119491
"Miljević, N., Golobočanin, D., Ogrinc, N., BondžLić, A.","Distribution of stable isotopes in surface water along the Danube River in Serbia",2008,"Isotopes in Environmental and Health Studies","44","2",,"137","148",,15,10.1080/10256010802066141,"https://www.scopus.com/inward/record.uri?eid=2-s2.0-46249129985&partnerID=40&md5=feec349042d08b562726f479c760ec0b",Conference Paper,Scopus,2-s2.0-46249129985
"Coops, H., Buijse, L.L., Buijse, A.D., Constantinescu, A., Covaliov, S., Hanganu, J., Ibelings, B.W., Menting, G., Navodaru, I., Oosterberg, W., Staras, M., Török, L.","Trophic gradients in a large-river delta: Ecological structure determined by connectivity gradients in the Danube delta (Romania)",2008,"River Research and Applications","24","5",,"698","709",,17,10.1002/rra.1136,"https://www.scopus.com/inward/record.uri?eid=2-s2.0-47249113038&partnerID=40&md5=388ccfd7524523e23099bb4085dad30f",Conference Paper,Scopus,2-s2.0-47249113038
"Bábek, O., Hilscherová, K., Nehyba, S., Zeman, J., Famera, M., Francu, J., Holoubek, I., MacHát, J., Klánová, J.","Contamination history of suspended river sediments accumulated in oxbow lakes over the last 25 years: Morava River (Danube catchment area), Czech Republic",2008,"Journal of Soils and Sediments","8","3",,"165","176",,39,10.1007/s11368-008-0002-8,"https://www.scopus.com/inward/record.uri?eid=2-s2.0-45849112148&partnerID=40&md5=0f153230475915ccc875ae63657a40b3",Article,Scopus,2-s2.0-45849112148
"Klemenčić, M.","Main characteristics of the geographical position of Vukovar [Glavne odrednice geografskoga položaja Vukovara]",2008,"Drustvena Istrazivanja","17","1-2",,"125","134",,1,,"https://www.scopus.com/inward/record.uri?eid=2-s2.0-43949145653&partnerID=40&md5=863ef4e6be7349d94a3a6e26b5e88c4e",Article,Scopus,2-s2.0-43949145653
"Živaković-Kerže, Z.","Along the Danube valley transportation route (Review of the economic development of Vukovar in the 19th and beginning of 20th centuries) [Na podunavskom prometnom pravcu Osvrt na gospodarski rozvoj Vukovara u 19. i na početku 20. stoljeća]",2008,"Drustvena Istrazivanja","17","1-2",,"135","148",,,,"https://www.scopus.com/inward/record.uri?eid=2-s2.0-43949094207&partnerID=40&md5=9ef8b01c719c789335ae4dd1ca5a726b",Article,Scopus,2-s2.0-43949094207
"Keiter, S., Grund, S., Van Bavel, B., Hagberg, J., Engwall, M., Kammann, U., Klempt, M., Manz, W., Olsman, H., Braunbeck, T., Hollert, H.","Activities and identification of aryl hydrocarbon receptor agonists in sediments from the Danube river",2008,"Analytical and Bioanalytical Chemistry","390","8",,"2009","2019",,62,10.1007/s00216-007-1652-x,"https://www.scopus.com/inward/record.uri?eid=2-s2.0-43349100198&partnerID=40&md5=f622fe6a8c9229183bdea0fcf72d9bbc",Article,Scopus,2-s2.0-43349100198
"Bonacci, O., Trninić, D., Roje-Bonacci, T.","Analysis of the water temperature regime of the Danube and its tributaries in Croatia",2008,"Hydrological Processes","22","7",,"1014","1021",,28,10.1002/hyp.6975,"https://www.scopus.com/inward/record.uri?eid=2-s2.0-41449113258&partnerID=40&md5=e76cf2f203b2d04f43e1ca02f44ec992",Article,Scopus,2-s2.0-41449113258
"Seitz, N., Böttcher, M., Keiter, S., Kosmehl, T., Manz, W., Hollert, H., Braunbeck, T.","A novel statistical approach for the evaluation of comet assay data",2008,"Mutation Research - Genetic Toxicology and Environmental Mutagenesis","652","1",,"38","45",,33,10.1016/j.mrgentox.2007.12.004,"https://www.scopus.com/inward/record.uri?eid=2-s2.0-40849140692&partnerID=40&md5=85437f794481cde3402fcec618f4a90f",Article,Scopus,2-s2.0-40849140692
"Vosniakos, F., Vasile, G., Petre, J., Cruceru, I., Nicolau, M., Mitrita, M., Iancu, V., Cruceru, L.","The evolution of the physical-chemical quality state of the Danube Delta aquatic ecosystem in the period May-October 2005/2006",2008,"Fresenius Environmental Bulletin","17","2",,"142","153",,3,,"https://www.scopus.com/inward/record.uri?eid=2-s2.0-40649102207&partnerID=40&md5=9902f9800b35fd5cf62595888c09da28",Article,Scopus,2-s2.0-40649102207
"Šedivá, A., Janko, K., ŠlechtovÁ, V., Kotlík, P., Simonović, P., Delic, A., Vassilev, M.","Around or across the Carpathians: Colonization model of the Danube basin inferred from genetic diversification of stone loach (Barbatula barbatula) populations",2008,"Molecular Ecology","17","5",,"1277","1292",,16,10.1111/j.1365-294X.2007.03656.x,"https://www.scopus.com/inward/record.uri?eid=2-s2.0-39749139575&partnerID=40&md5=aef50386d49e53da3c77ede6c9f94ecb",Article,Scopus,2-s2.0-39749139575
"Audzijonyte, A., Wittmann, K.J., Väinölä, R.","Tracing recent invasions of the Ponto-Caspian mysid shrimp Hemimysis anomala across Europe and to North America with mitochondrial DNA",2008,"Diversity and Distributions","14","2",,"179","186",,40,10.1111/j.1472-4642.2007.00434.x,"https://www.scopus.com/inward/record.uri?eid=2-s2.0-38849112729&partnerID=40&md5=d7b2a6d5ceafab0a0ba9c878f004fd7d",Article,Scopus,2-s2.0-38849112729
"Beltrami, M.E., Cappelletti, C., Ciutti, F.","Didymosphenia geminata (Lyngbye) M. Schmidt (Bacillariophyta) in the Danube basin: New data from the Drava river (northern Italy)",2008,"Plant Biosystems","142","1",,"126","129",,8,10.1080/11263500701872788,"https://www.scopus.com/inward/record.uri?eid=2-s2.0-40549115377&partnerID=40&md5=64a0f84b2a1f88797cf7d0c80985506e",Article,Scopus,2-s2.0-40549115377
"Preiner, S., Drozdowski, I., Schagerl, M., Schiemer, F., Hein, T.","The significance of side-arm connectivity for carbon dynamics of the River Danube, Austria",2008,"Freshwater Biology","53","2",,"238","252",,21,10.1111/j.1365-2427.2007.01888.x,"https://www.scopus.com/inward/record.uri?eid=2-s2.0-38149008054&partnerID=40&md5=7bca8020a1e0b0728b4ca8fd3c7b57af",Article,Scopus,2-s2.0-38149008054
"Richter, D., Tostevin, G., Škrdla, P.","Bohunician technology and thermoluminescence dating of the type locality of Brno-Bohunice (Czech Republic)",2008,"Journal of Human Evolution","55","5",,"871","885",,27,10.1016/j.jhevol.2008.04.008,"https://www.scopus.com/inward/record.uri?eid=2-s2.0-55749108176&partnerID=40&md5=c2d8152d50feaba508fa02fc97c78e63",Article,Scopus,2-s2.0-55749108176
"Nagy, P., Fekete, J., Sharma, V.K.","Monofluorinated polycyclic aromatic hydrocarbons: Surrogate standards for HPLC analysis of surface water and sediment samples",2008,"Journal of Liquid Chromatography and Related Technologies","31","2",,"240","249",,1,10.1080/10826070701738969,"https://www.scopus.com/inward/record.uri?eid=2-s2.0-37249060436&partnerID=40&md5=950ff05f58f39188ac1980c3c0434282",Article,Scopus,2-s2.0-37249060436
"Borković, S.S., Pavlović, S.Z., Kovačević, T.B., Štajn, A.Š., Petrović, V.M., Saičić, Z.S.","Antioxidant defence enzyme activities in hepatopancreas, gills and muscle of Spiny cheek crayfish (Orconectes limosus) from the River Danube",2008,"Comparative Biochemistry and Physiology - C Toxicology and Pharmacology","147","1",,"122","128",,36,10.1016/j.cbpc.2007.08.006,"https://www.scopus.com/inward/record.uri?eid=2-s2.0-36849028663&partnerID=40&md5=bcd3c4192565f87ace77638af6571476",Article,Scopus,2-s2.0-36849028663
"Dankers, R., Christensen, O.B., Feyen, L., Kalas, M., de Roo, A.","Evaluation of very high-resolution climate model data for simulating flood hazards in the Upper Danube Basin",2007,"Journal of Hydrology","347","3-4",,"319","331",,26,10.1016/j.jhydrol.2007.09.055,"https://www.scopus.com/inward/record.uri?eid=2-s2.0-36249032018&partnerID=40&md5=e495fde5da56b0e3c52ee251d76d3090",Article,Scopus,2-s2.0-36249032018
"Stanica, A., Dan, S., Ungureanu, V.G.","Coastal changes at the Sulina mouth of the Danube River as a result of human activities",2007,"Marine Pollution Bulletin","55","10-12",,"555","563",,33,10.1016/j.marpolbul.2007.09.015,"https://www.scopus.com/inward/record.uri?eid=2-s2.0-36549011251&partnerID=40&md5=92eb9b2e11d4e7f3973000e776fa4c02",Article,Scopus,2-s2.0-36549011251
"Cukic, V.Z., Knezic, V.L.","Biodegradability of Danube bank filtrate and its enhancement by ozonation",2007,"Water Science and Technology: Water Supply","7","3",,"139","144",,,10.2166/ws.2007.076,"https://www.scopus.com/inward/record.uri?eid=2-s2.0-38349048411&partnerID=40&md5=24d5a4a2dd8ae9c040f002465cc20dce",Conference Paper,Scopus,2-s2.0-38349048411
"Cakić, P., Paunović, M., Stojanović, B., Dikanović, V., Kulišić, Z.","Metagonimus yokogawai, a new parasitic trematoda species in ichtyoparasitofauna of the Serbia",2007,"Acta Veterinaria","57","5-6",,"537","543",,3,10.2298/AVB0706537C,"https://www.scopus.com/inward/record.uri?eid=2-s2.0-38549099476&partnerID=40&md5=cdec33a65e7d4662dcadca39a00e4bc9",Article,Scopus,2-s2.0-38549099476
"Vitvar, T., Newman, B.D., Aggarwal, P., Garner, A.","Application of environmental isotopes for studying stream/aquifer interactions in the Danube basin",2007,"Water Science and Technology: Water Supply","7","3",,"25","30",,1,10.2166/ws.2007.063,"https://www.scopus.com/inward/record.uri?eid=2-s2.0-38349060804&partnerID=40&md5=fa4b8c542cca35ff7dd4323cfc7f4edf",Conference Paper,Scopus,2-s2.0-38349060804
"Szalai, Z.","Effects of channelization on the sediment quality of the Danube and Tisza rivers, Hungary",2007,"Geografia Fisica e Dinamica Quaternaria","30","2",,"249","254",,1,,"https://www.scopus.com/inward/record.uri?eid=2-s2.0-55849144055&partnerID=40&md5=c1a36065f6ead141a303570de43372dc",Conference Paper,Scopus,2-s2.0-55849144055
"Bratosin, O.","Baragan: Geographical space in Rumanian literature [Le baragan: Espace geographique dans la litterature Roumaine]",2007,"Travaux de l'Institut de Geographie de Reims","33","129-130",,"79","94",,,,"https://www.scopus.com/inward/record.uri?eid=2-s2.0-84874895026&partnerID=40&md5=58f537e19fb6bef01037e5aad9c8fc65",Article,Scopus,2-s2.0-84874895026
"Mauser, W., Prasch, M., Strasser, U.","Physically based modelling of climate change impact on snow cover dynamics in alpine regions using a stochastic weather generator",2007,"MODSIM07 - Land, Water and Environmental Management: Integrated Systems for Sustainability, Proceedings",,,,"2138","2145",,2,,"https://www.scopus.com/inward/record.uri?eid=2-s2.0-80052932664&partnerID=40&md5=762b3674f8b6c98f8d2e7d7ed8006e66",Conference Paper,Scopus,2-s2.0-80052932664
"Rakonczai, J.","Global change and landscape change in Hungary",2007,"Geografia Fisica e Dinamica Quaternaria","30","2",,"229","232",,4,,"https://www.scopus.com/inward/record.uri?eid=2-s2.0-55849108900&partnerID=40&md5=a357b4c7ffb65d861c4f7dc37fa80293",Conference Paper,Scopus,2-s2.0-55849108900
"Appel, F., Bach, H., Ohl, N., Mauser, W.","Provision of snow water equivalent from satellite data and the hydrological model PROMET using data assimilation techniques",2007,"International Geoscience and Remote Sensing Symposium (IGARSS)",,, 4423779,"4209","4212",,1,10.1109/IGARSS.2007.4423779,"https://www.scopus.com/inward/record.uri?eid=2-s2.0-82355186617&partnerID=40&md5=7bcceb0ca0704988b0b5437c7ca9130d",Conference Paper,Scopus,2-s2.0-82355186617
"Sax, M., Schmude, J., Dingeldey, A.","Water and tourism - simulating the tourist water use in the upper danube catchment area",2007,"IAHS-AISH Publication",,"317",,"66","71",,,,"https://www.scopus.com/inward/record.uri?eid=2-s2.0-55849142304&partnerID=40&md5=8f94534b76020ff21bda7b75d121e997",Conference Paper,Scopus,2-s2.0-55849142304
"Hein, T., Blaschke, A.P., Haidvogl, G., Hohensinner, S., Reckendorfer, W., Reiter, K., Schuh, B., Weigelhofer, G.","Urban flood plains - optimised management strategies in the face of conflicting ecological and socio-economic demands",2007,"IAHS-AISH Publication",,"317",,"258","262",,,,"https://www.scopus.com/inward/record.uri?eid=2-s2.0-55849083968&partnerID=40&md5=e662afe52d468f6fa6c173a1dcb51907",Conference Paper,Scopus,2-s2.0-55849083968
"Saddington, D.B.","Classes. The Evolution of the Roman Imperial Fleets",2007,"A Companion to the Roman Army",,,,"201","217",,2,10.1002/9780470996577.ch13,"https://www.scopus.com/inward/record.uri?eid=2-s2.0-84889352419&partnerID=40&md5=8cf724d1377ccaa72a115fda703f3cdf",Book Chapter,Scopus,2-s2.0-84889352419
"Szabó, K.É., Kiss, K.T., Tóth, B., Metzeltin, D., Ács, É.","Navicula novaesiberica Lange-Bertalot; a new record of the species from the Danube river in Hungary",2007,"Diatom Research","22","2",,"497","502",,3,,"https://www.scopus.com/inward/record.uri?eid=2-s2.0-36448953481&partnerID=40&md5=4550e22e367299faad2ed84c57ac3fce",Article,Scopus,2-s2.0-36448953481
"Covasnianu, A., Cazacu, M., Libralesso, N., Galisson, L., Memier, M., Balin, I.","Digital terrain model by airborne LIDAR technique: An essential tool for hydrologic risks assessment",2007,"Journal of Optoelectronics and Advanced Materials","9","11",,"3529","3532",,1,,"https://www.scopus.com/inward/record.uri?eid=2-s2.0-38549181282&partnerID=40&md5=182bd5858815d9f7e19f2cb566761f61",Conference Paper,Scopus,2-s2.0-38549181282
"Molloy, D.P., Bij De Vaate, A., Wilke, T., Giamberini, L.","Discovery of Dreissena rostriformis bugensis (Andrusov 1897) in Western Europe",2007,"Biological Invasions","9","7",,"871","874",,28,10.1007/s10530-006-9078-5,"https://www.scopus.com/inward/record.uri?eid=2-s2.0-34548666641&partnerID=40&md5=64528fc3b44f9ba3952a2a86e601518e",Article,Scopus,2-s2.0-34548666641
"Vadadi-Fülöp, Cs., Mészáros, G., Jablonszky, Gy., Hufnagel, L.","Ecology of the Ráckeve-Soroksár Danube - A review",2007,"Applied Ecology and Environmental Research","5","1",,"133","163",,4,,"https://www.scopus.com/inward/record.uri?eid=2-s2.0-34548746864&partnerID=40&md5=f21578c2650b02c7b6933cd910445d07",Review,Scopus,2-s2.0-34548746864
"Bondar, E., Kucera-Hirzinger, V., Preiner, S., Weigelhofer, G., Schiemer, F., Hein, T.","The impact of an artificial water enhancement scheme on phosphorus dynamics in an urban floodplain system in Vienna (Austria)",2007,"International Review of Hydrobiology","92","4-5",,"413","427",,7,10.1002/iroh.200510985,"https://www.scopus.com/inward/record.uri?eid=2-s2.0-34548499344&partnerID=40&md5=d839c18202cd23c2c031122556770d67",Article,Scopus,2-s2.0-34548499344
"McCarthy, J.J., Yilmaz, A., Coban-Yildiz, Y., Nevins, J.L.","Nitrogen cycling in the offshore waters of the Black Sea",2007,"Estuarine, Coastal and Shelf Science","74","3",,"493","514",,30,10.1016/j.ecss.2007.05.005,"https://www.scopus.com/inward/record.uri?eid=2-s2.0-34547581980&partnerID=40&md5=8a828598b6e5592d6f16c94e4b3ec281",Article,Scopus,2-s2.0-34547581980
"Bǎnaru, D., Harmelin-Vivien, M., Gomoiu, M.-T., Onciu, T.-M.","Influence of the Danube River inputs on C and N stable isotope ratios of the Romanian coastal waters and sediment (Black Sea)",2007,"Marine Pollution Bulletin","54","9",,"1385","1394",,22,10.1016/j.marpolbul.2007.05.022,"https://www.scopus.com/inward/record.uri?eid=2-s2.0-35548936987&partnerID=40&md5=3c3ef47eac4f0bf46433a237142d549d",Article,Scopus,2-s2.0-35548936987
"Lyashenko, A.V., Zorina-Sakharova, Ye.Ye., Makovskiy, V.V.","Modern state of the macrofauna of invertebrates of the ukrainian part of the lower reaches of the danube river",2007,"Hydrobiological Journal","43","4",,"21","34",,,10.1615/HydrobJ.v43.i4.20,"https://www.scopus.com/inward/record.uri?eid=2-s2.0-34547790828&partnerID=40&md5=d7df0f178e7ea90e058e6f0cecc98076",Article,Scopus,2-s2.0-34547790828
"Stefanov, T., Holčík, J.","The lampreys of Bulgaria",2007,"Folia Zoologica","56","2",,"213","224",,2,,"https://www.scopus.com/inward/record.uri?eid=2-s2.0-34547622301&partnerID=40&md5=32548ccd8dcd892811001d82444fbdc6",Article,Scopus,2-s2.0-34547622301
"Baranya, S., Józsa, J.","Numerical and laboratory investigation of the hydrodynamic complexity of a river confluence",2007,"Periodica Polytechnica: Civil Engineering","51","1",,"3","8",,2,10.3311/pp.ci.2007-1.01,"https://www.scopus.com/inward/record.uri?eid=2-s2.0-34547590293&partnerID=40&md5=3b62cac8255238af4978b0c271050067",Article,Scopus,2-s2.0-34547590293
"Martinovic-Vitanovic, V., Djikanovic, V., Obradovic, S., Kalafatic, V.","Composition and structure of the Oligochaeta (Annelida) in benthic assemblages of the Danube river in the Belgrade region during May and October of 2004",2007,"Ekologia Bratislava","26","2",,"174","189",,5,,"https://www.scopus.com/inward/record.uri?eid=2-s2.0-34547431492&partnerID=40&md5=3c9ee48f7fbefecddc52c47f440d5080",Article,Scopus,2-s2.0-34547431492
"Klaver, G., van Os, B., Negrel, P., Petelet-Giraud, E.","Influence of hydropower dams on the composition of the suspended and riverbank sediments in the Danube",2007,"Environmental Pollution","148","3",,"718","728",,36,10.1016/j.envpol.2007.01.037,"https://www.scopus.com/inward/record.uri?eid=2-s2.0-34249981775&partnerID=40&md5=43576ceae88bf408813ded53b08aeb57",Article,Scopus,2-s2.0-34249981775
"Voulgaropoulos, A., Todorovic, M., Cruceru, L., Manojlovic, D., Trbovic, D., Nesic, B., Krsmanovic, V.D.","Determination of trace elements in danube water: results of the regional-interlaboratory study",2007,"Desalination","213","1-3",,"110","115",,5,10.1016/j.desal.2006.04.084,"https://www.scopus.com/inward/record.uri?eid=2-s2.0-34347370081&partnerID=40&md5=4064b5923f011000c0f790141e4f7270",Article,Scopus,2-s2.0-34347370081
